id,name,about,name_trans,about_trans
S_LinuxFoundationX,Linux基金会,"Linux基金会是一个非盈利性的联盟，其目的在于协调和推动Linux系统的发展，以及宣传、保护和规范Linux，该组织是2007年，由开源码发展实验室（Open Source Development Labs，OSDL)与自由标准组织（Free Standards Group ,FSG)联合起来成立的，其中MeeGo是Linux基金会管理下的Linux操作系统。",linux foundation,the linux foundation is a non profit alliance whose purpose is to coordinate and promote the development of linux systems as well as promote protect and standardize linux the organization was established in 2007 by the open source development labs osdl established in conjunction with the free standards group fsg meego is a linux operating system managed by the linux foundation
S_CUNY,学堂在线,学堂在线是清华大学发起的精品中文慕课平台，为广大学习者提供来自清华、北大、斯坦福、MIT等知名高校创业、经管、语言、计算机等各类课程，及优质的在线学习服务，让每一个学习者都有机会享受优质的教育资源。,xuetang online,xuetang online is a high quality chinese mooc platform initiated by tsinghua university it provides learners with various courses on entrepreneurship economics and management languages computers and other well known universities such as tsinghua university peking university stanford and mit as well as high quality online learning services allowing everyone to every learner has the opportunity to enjoy high quality educational resources
S_CSMZXY,长沙民政职业技术学院,长沙民政职业技术学院地处湖南省长沙市，是民政部和湖南省人民政府共建、湖南省教育厅直属普通高等院校，全国首批（28所）国家示范性高等职业院校之一、国家首批现代学徒制试点单位，全国第二批深化创新创业教育改革示范高校、首批民政部社会工作专业人才培训基地。,changsha vocational and technical college of civil affairs,changsha civil affairs vocational and technical college is located in changsha city hunan province it is a general higher education institution jointly established by the ministry of civil affairs and the hunan provincial peoples government and directly under the hunan provincial department of education it is one of the first batch 28 of national model higher vocational colleges in the country it is one of the first batch of national modern apprenticeship pilot units the second batch of national demonstration universities for deepening innovation and entrepreneurship education reform and the first batch of training bases for social work professionals of the ministry of civil affairs
S_XYSFXY,咸阳师范学院,咸阳师范学院（Xianyang Normal University）简称“咸阳师院”，位于陕西咸阳，是一所以教师教育为特色的普通省属本科院校，是陕西省一流应用型本科院校建设单位、省级硕士学位授予单位立项建设单位。,xianyang normal university,xianyang normal university referred to as xianyang normal university is located in xianyang shaanxi province it is a general provincial undergraduate college featuring teacher education it is a first class applied undergraduate college construction unit in shaanxi province and a provincial masters degree program awarded unit to establish project construction unit
S_xuetangX,学堂在线,"学堂在线是清华大学发起的精品中文慕课平台,为广大学习者提供来自清华、北大、斯坦福、MIT等知名高校创业、经管、语言、计算机等各类1000余门免费课程。",xuetang online,xuetang online is a high quality chinese mooc platform launched by tsinghua university it provides learners with more than 1000 free courses in entrepreneurship economics and management languages computers etc from well known universities such as tsinghua university peking university stanford and mit
S_ACCA,ACCA,特许公认会计师公会(The Association of Chartered Certified Accountants，简称ACCA))成立于1904年，是目前世界上领先的专业会计师团体，也是国际上海外学员最多、学员规模发展最快的专业会计师组织。英国立法许可ACCA会员从事审计、投资顾问和破产执行的工作。ACCA会员资格得到欧盟立法以及许多国家公司法的承认。ACCA是国际会计准则委员会(IASC)的创始成员，也是国际会计师联合会(IFAC)的主要成员，1999年2月联合国通过了以ACCA课程大纲为蓝本的《职业会计师专业教育国际大纲》，该大纲将作为世界各地职业会计师考试课程设置的一个衡量基准。,acca,the association of chartered certified accountants acca was founded in 1904 it is currently the worlds leading professional accountant group it is also the professional accountant organization with the largest number of overseas students and the fastest growing student base in the world british legislation permits acca members to engage in auditing investment advisory and bankruptcy enforcement work acca membership is recognized by eu legislation as well as many national company laws acca is a founding member of the international accounting standards committee iasc and a major member of the international federation of accountants ifac in february 1999 the united nations adopted the international syllabus for professional education for professional accountants based on the acca syllabus it will serve as a benchmark for professional accountant examination curriculum around the world
S_haust,河南科技大学,河南科技大学（Henan University of Science and Technology）简称河科大（HAUST），坐落于“千年帝都，牡丹花城”、中原城市群副中心城市——洛阳，是国家国防科工局与河南省人民政府共建高校，省属重点大学，河南省重点建设的三所综合性大学之一，位列中西部高校基础能力建设工程、卓越工程师教育培养计划、卓越医生教育培养计划、卓越农林人才教育培养计划，入选全国深化创新创业教育改革示范高校、国家级专业技术人员继续教育基地、首批高等学校科技成果转化和技术转移基地，也是新丝绸之路大学联盟理事高校，教育部首批认定有条件接收外国留学生的高校、教育部本科教学评估优秀高校。,henan university of science and technology,henan university of science and technology referred to as haust is located in luoyang the millennium imperial capital peony city and the sub central city of the central plains urban agglomeration it is a joint venture between the state administration of science technology and industry for national defense and the henan provincial peoples government it is a provincial key university and one of the three comprehensive universities in henan province it ranks among the basic capacity building projects of colleges and universities in the central and western regions the outstanding engineer education and training plan the excellent doctor education and training plan and the outstanding agricultural and forestry talent education and training plan it was selected as a national demonstration university for deepening innovation and entrepreneurship education reform a national continuing education base for professional and technical personnel and one of the first batch of higher education scientific and technological achievement transformation and technology transfer bases it is also a member university of the new silk road university alliance and one of the first batch of universities recognized by the ministry of education as conditionally accepting foreign students universities for international students and excellent universities in the undergraduate teaching evaluation of the ministry of education
S_SXPI,陕西工业职业技术学院,陕西工业职业技术学院（Shaanxi Polytechnic Institute）地处历史文化名城咸阳，是1999年3月经教育部批准、由创办于1950年的国家级重点中专——咸阳机器制造学校改制升格的省属全日制普通高等学校，是西北地区首家由教育部批准改制升格的高职学院。2010年1月，与陕西纺织服装职业技术学院合并组建成新的陕西工业职业技术学院。,shaanxi industrial vocational and technical college,shaanxi polytechnic institute is located in the historical and cultural city of xianyang it was approved by the ministry of education in march 1999 and was restructured and upgraded from xianyang machinery manufacturing school a national key technical secondary school founded in 1950 it is the first higher vocational college in the northwest region to be restructured and upgraded with the approval of the ministry of education in january 2010 it merged with shaanxi textile and clothing vocational and technical college to form the new shaanxi industrial vocational and technical college
S_BIFT,北京服装学院,北京服装学院，是全国唯一以服装命名，艺工为主，艺、工、经、管等多学科协调发展的全日制普通高等学校。,beijing institute of fashion technology,beijing institute of fashion technology is the only full time general institution of higher learning in the country that is named after clothing focuses on art and engineering and coordinates the development of art engineering economics management and other disciplines
S_NDU,国防大学,中国人民解放军国防大学（National Defence University of People's Liberation Army，NDU、PLA）是中共中央军事委员会直属的一所中国最高军事学府，副战区级别，是全军“2110工程”重点建设院校、中国军队高级任职教育的一所综合性联合指挥大学。,national defense university,the national defense university of the peoples liberation army ndu pla is chinas highest military institution directly under the central military commission of the communist party of china it is at the deputy theater level and is a key construction institution of the plas 2110 project a comprehensive joint command university for advanced professional education
S_FDU,复旦大学,复旦大学（Fudan University），简称“复旦”，位于中国上海，由中华人民共和国教育部直属，中央直管副部级建制，位列985工程、211工程、双一流A类，入选“珠峰计划”、“111计划”、“2011计划”、“卓越医生教育培养计划”，为“九校联盟”成员、中国大学校长联谊会成员、东亚研究型大学协会成员、环太平洋大学协会成员，是一所世界知名、国内顶尖的全国重点大学。,fudan university,fudan university referred to as fudan is located in shanghai china it is directly under the ministry of education of the peoples republic of china and directly managed by the central government at the deputy ministerial level it ranks among the 985 project 211 project double first class category a and was selected for the everest plan  111 plan 2011 plan excellent doctor education and training plan is a member of the nine university alliance a member of the chinese university presidents association a member of the association of east asian research universities and a member of the association of pacific rim universities a world renowned and domestic top national key university
S_CWU,中华女子学院,中华女子学院（CHINA WOMEN'S UNIVERSITY）地处中国首都北京，是直属中华全国妇女联合会、教育部批准备案的全国第一所公办全日制本科女子普通高等学校，学校为中国女子高等院校联盟高校、中美人才培养计划高校、首批民政部社会工作专业人才培训基地、北京市'一带一路'国家人才培养基地项目学校，是中国妇女研究会妇女教育专业委员会、中国婚姻家庭法学研究会秘书处单位、服务国家特殊需求硕士专业学位人才培养项目试点单位联盟成员。,china women's university,china womens university is located in beijing the capital of china it is the countrys first public full time undergraduate womens general higher education institution directly under the all china womens federation and approved by the ministry of education the school is a member of the china womens higher education alliance university it is a university under the sino us talent training plan one of the first batch of training bases for social work professionals of the ministry of civil affairs and a beijing belt and road national talent training base project school it is a member of the womens education professional committee of the china womens research association and the secretariat unit of the china marriage and family law research association  a member of the alliance of pilot units serving the countrys special needs masters degree talent training project
S_VPC_TsinghuaX,清华大学,清华大学（Tsinghua University），简称'清华'，由中华人民共和国教育部直属，中央直管副部级建制，被誉为'红色工程师的摇篮'。,tsinghua university,tsinghua university referred to as tsinghua is directly under the ministry of education of the peoples republic of china and is directly managed by the central government at the deputy ministerial level it is known as the cradle of red engineers
S_CQUX,重庆大学,重庆大学（Chongqing University），简称重大（CQU），位于中央直辖市重庆，是中共中央直管，教育部直属的副部级全国重点大学，是国家31所中管高校之一，由教育部和重庆市共同建设。重大早在民国时期就是中国最杰出的国立大学之一；现是国家“双一流”A类世界一流大学、“211工程”和“985工程”首批重点建设的高水平研究型综合性大学；入选“2011计划”、“111计划”、“卓越工程师教育培养计划”、“卓越法律人才教育培养计划”、“海外高层次人才引进计划”、“中国政府奖学金来华留学生接收院校”、“教育部来华留学示范基地”、“国家建设高水平大学公派研究生项目”；也是“中俄工科大学联盟”、“中英大学工程教育与研究联盟”、“重庆市大学联盟”、“中国酿酒高校联盟”成员，设有研究生院。,chongqing university,chongqing university referred to as cqu is located in chongqing a municipality directly under the central government it is a vice ministerial national key university directly under the central committee of the communist party of china and directly under the ministry of education it is one of the countrys 31 centrally managed universities and is jointly managed by the ministry of education and chongqing university city joint construction jnu has been one of the most outstanding national universities in china as early as the republic of china now it is a national double first class class a world class university and one of the first batch of key construction high level research oriented comprehensive universities under the 211 project and 985 project selected into the 2011 plan 111 plan excellent engineer education and training plan excellent legal talent education and training plan overseas high level talent introduction plan chinese government scholarship receiving colleges for international students in china  demonstration base for studying in china by the ministry of education national postgraduate program for building high level universities also china russian engineering university alliance sino british university engineering education and research alliance chongqing university alliance china brewery it is a member of the university alliance and has a graduate school
S_PPSUC,中国人民公安大学,中国人民公安大学（Peoples Public Security University of China），简称“公大”，地处中国北京，是公安部直属的普通高等院校暨公安部高级警官学院，创办于1948年7月，历经华北公安干部学校、中央公安干部学校、中央人民公安学院、中央政法干部学校等时期。1984年1月，改建为全日制普通高等本科院校。1998年2月，与原中国人民警官大学合并，组成新的中国人民公安大学。学校是国家首批“双一流”世界一流学科建设高校和国家首批“卓越法律人才教育培养计划”试点高校。,people's public security university of china,peoples public security university of china referred to as public university is located in beijing china it is a general higher education institution directly under the ministry of public security and a senior police academy of the ministry of public security it was founded in july 1948 and has experienced the development of the north china public security university cadre school central public security cadre school central peoples public security college central political and legal cadre school etc in january 1984 it was converted into a full time general undergraduate college in february 1998 it merged with the original peoples police university of china to form the new peoples police university of china the school is among the first batch of national double first class world class discipline construction universities and the first batch of national pilot universities for the excellent legal talent education and training plan
S_qhnu,青海师范大学,青海师范大学（Qinghai Normal University），简称青海师大（QNU），位于青海省省会——西宁市，建于1956年，学校具有本科教育、研究生教育、留学生教育等完备的教育体系，学科专业覆盖哲学、经济学、法学、教育学、文学、历史学、理学、工学、管理学、艺术学等10大门类。,qinghai normal university,qinghai normal university referred to as qnu qnu is located in xining city the capital of qinghai province it was founded in 1956 the school has a complete education system for undergraduate education graduate education and international student education covering a wide range of disciplines and majors there are 10 major categories including philosophy economics law education literature history science engineering management and art
S_WHUT,武汉理工大学,武汉理工大学是中华人民共和国教育部直属的理工类全国重点大学，由国家教育部、交通运输部、国家海洋局、国家国防科技工业局共建，是国家首批“211工程”、“985工程优势学科创新平台”重点建设高校，国家首批“双一流”世界一流学科建设高校，是“111计划”、“卓越工程师教育培养计划”、“海外高层次人才引进计划”、“国家建设高水平大学公派研究生项目”等重点建设的中国高水平研究型大学。,wuhan university of technology,wuhan university of technology is a national key university in science and engineering directly under the ministry of education of the peoples republic of china it is jointly established by the ministry of education the ministry of transport the state oceanic administration and the state administration of science technology and industry for national defense it is one of the first batch of 211 project and 985 project in the country advantageous discipline innovation platform key construction universities the countrys first batch of double first class world class discipline construction universities are 111 plan excellent engineer education and training plan overseas high level talent introduction plan national construction high level it is a high level research university in china that is key to the construction of university publicly sponsored graduate program
S_GXUST,广西科技大学,广西科技大学坐落在中国历史文化名城、中国工业化信息化融合试点城市——柳州市，是国务院学位委员会批准的学士、硕士学位授权单位，是“卓越医生教育培养计划”试点高校，直属于广西壮族自治区人民政府管理。2013年经自治区学位委员会批准，正式确定为2013-2018年立项建设新增博士学位授予单位。是一所以工为主，包含工、管、理、经、文、法、艺术、教育、医学等9大学科门类的多科性高等学校。,guangxi university of science and technology,guangxi university of science and technology is located in liuzhou a famous historical and cultural city in china and a pilot city for the integration of industrialization and informatization in china it is a bachelors and masters degree authorization unit approved by the academic degrees committee of the state council it is a pilot university for the excellent doctor education and training plan and is directly affiliated to the guangxi zhuang ethnic group managed by the peoples government of the autonomous region in 2013 with the approval of the autonomous region academic degrees committee it was officially determined to be a new doctoral degree granting unit for the project construction from 2013 to 2018 it is a multi disciplinary institution of higher learning that focuses on engineering and includes nine major disciplines engineering management science economics liberal arts law art education and medicine
S_MUC,中央民族大学,中央民族大学（Minzu University of China），简称“中央民大”，坐落于北京市海淀区，南邻国家图书馆，北依中关村科技园，由北京市、国家民委和中华人民共和国教育部共建，学校1978年被批准为全国重点大学，位列国家世界一流大学建设高校（A类）、211工程和985工程重点建设大学行列，也是国家卓越法律人才教育培养计划、教育部来华留学示范基地、国家建设高水平大学公派研究生项目、中国政府奖学金来华留学生接收院校之一。,minzu university of china,minzu university of china referred to as minzu university of china is located in haidian district beijing adjacent to the national library to the south and zhongguancun science and technology park to the north it is jointly funded by beijing municipality the national ethnic affairs commission and the ministry of education of the peoples republic of china established the school was approved as a national key university in 1978 ranking among the national world class university construction universities category a the 211 project and the 985 project key construction universities it is also the national outstanding legal talent education and training program the ministry of educations study abroad demonstration in china it is one of the bases nationally sponsored postgraduate programs for high level universities and one of the institutions receiving chinese government scholarships for international students in china
S_FZXY,防灾科技学院,防灾科技学院隶属于中国地震局，被国务院学位委员会列为“服务国家特殊需求人才培养项目”试点工作单位；被教育部批准为“卓越工程师教育培养计划”工作单位。是中国仅有的以防灾减灾高等教育为主、学科门类齐全的综合性全日制普通高等本科院校。,institute of disaster prevention technology,the institute of disaster prevention science and technology is affiliated to the china earthquake administration and has been listed as a pilot unit of the talent training project to serve the national special needs by the academic degrees committee of the state council it has been approved by the ministry of education as a unit of the excellent engineer education and training program it is the only comprehensive full time general undergraduate institution in china that focuses on higher education in disaster prevention and reduction and has a full range of disciplines
S_shsmu,上海交通大学,上海交通大学（Shanghai Jiao Tong University）简称“上海交大”，位于上海市，是由中华人民共和国教育部直属、中央直管副部级建制的全国重点大学，是中国历史最悠久、享誉海内外的著名高等学府之一，位列“985工程”、“211工程”、“世界一流大学建设高校”，为九校联盟、中国大学校长联谊会、Universitas 21、21世纪学术联盟、国际应用科技开发协作网、新工科教育国际联盟重要成员，入选“珠峰计划”、“111计划”、“2011计划”、卓越医生教育培养计划、卓越法律人才教育培养计划、卓越工程师教育培养计划、卓越农林人才教育培养计划、国家建设高水平大学公派研究生项目、中国政府奖学金来华留学生接收院校。,shanghai jiao tong university,shanghai jiao tong university referred to as shanghai jiao tong university is located in shanghai it is a national key university directly under the ministry of education of the peoples republic of china and established at the deputy ministerial level directly under the central government it is the oldest university in china and is well known at home and abroad one of the famous institutions of higher learning ranked among the 985 project 211 project and world class university construction universities and is a member of the nine university alliance china university presidents association universitas 21 21st century academic alliance and international applied technology development collaboration network an important member of the international alliance for new engineering education and was selected into the everest plan 111 plan 2011 plan outstanding doctor education and training plan outstanding legal talent education and training plan outstanding engineer education and training plan and outstanding agriculture and forestry talent education training programs nationally sponsored postgraduate programs for high level universities and institutions receiving chinese government scholarships for international students in china
