id,name,about,name_trans,about_trans
S_GZHU,广州大学,广州大学，简称“广大”，是广东省和广州市重点建设的重点大学，教育部、财政部“国培计划”9所实施高校之一，全国首批12所“CDIO工程教育模式改革研究与实践”试点高校，也是“卓越法律人才教育培养计划”、“卓越工程师教育培养计划”、“国家级大学生创新创业训练计划”重点建设高校。学校已发展成为一所拥有哲学、经济学、法学、教育学、文学、历史学、理学、工学、管理学、艺术学等十大学科门类，在国内外具有一定知名度的综合性研究教学型大学。,guangzhou university,guangzhou university referred to as guangda is a key university under construction in guangdong province and guangzhou city it is one of the 9 universities implementing the national training plan of the ministry of education and the ministry of finance and the first 12 universities in the country to conduct cdio engineering education model reform research and development it is also a key construction university of the excellent legal talent education and training plan excellent engineer education and training plan and national college student innovation and entrepreneurship training plan the school has developed into a comprehensive research and teaching university with a certain reputation at home and abroad covering ten major disciplines including philosophy economics law education literature history science engineering management and art 
S_GIT,贵州理工学院,贵州理工学院（Guizhou Institute of Technology）位于贵州省贵阳市，是经教育部批准设立的一所省属本科理工院校。学校创建于2013年，2011年，贵州省提出实施“工业强省”战略，在原贵州大学蔡家关校区的校址上筹建贵州理工学院。2012年12月17日，贵州理工学院各项指标达到国家规定的本科学校设置标准，通过了全国高等学校设置评议委员会专家组的检查和评估。2013年4月18日，教育部正式下文批准建立贵州理工学院。2017年1月，成为全国首批深化创新创业教育改革示范高校。,guizhou institute of technology,guizhou institute of technology is located in guiyang city guizhou province it is a provincial undergraduate science and engineering college approved by the ministry of education the school was founded in 2013 in 2011 guizhou province proposed to implement the strategy of strengthening the province through industry and planned to build guizhou institute of technology on the site of the former caijiaguan campus of guizhou university on december 17 2012 all indicators of guizhou institute of technology met the national undergraduate school establishment standards and passed the inspection and evaluation by the expert group of the national higher education institutions evaluation committee on april 18 2013 the ministry of education officially approved the establishment of guizhou institute of technology in january 2017 it became the first batch of demonstration universities in the country to deepen the reform of innovation and entrepreneurship education
S_Sunlands,尚德机构,尚德机构是中国的职业教育机构，成立于2003年3月，致力于提高学员职场竞争力。尚德机构的培训课程和服务范围，从职业资格认证、技能培训，到与职业相关的就业服务，业务覆盖全国多个城市，服务全国学员。,suntech institution,suntech institution is a vocational education institution in china it was established in march 2003 and is committed to improving students workplace competitiveness suntechs training courses and services range from vocational qualification certification skills training to career related employment services its business covers many cities across the country and serves students across the country
S_NJU,南京大学,南京大学（Nanjing University），简称“南大”，是中华人民共和国教育部直属的综合性全国重点大学，位列世界一流大学建设高校（A类）、”211工程“、”985工程”，是九校联盟、中国大学校长联谊会、环太平洋大学联盟、21世纪学术联盟、国际应用科技开发协作网、东亚研究型大学协会、新工科教育国际联盟、中国高校行星科学联盟、长三角研究型大学联盟成员，入选“珠峰计划”、“111计划”、“2011计划”、卓越工程师教育培养计划、卓越医生教育培养计划、卓越法律人才教育培养计划、国家建设高水平大学公派研究生项目、新工科研究与实践项目、全国深化创新创业教育改革示范高校、中国政府奖学金来华留学生接收院校、教育部来华留学示范基地、国家级双创示范基地。,nanjing university,nanjing university referred to as nanjing university is a comprehensive national key university directly under the ministry of education of the peoples republic of china it is ranked among the worlds first class university construction universities category a 211 project and 985 project university alliance china association of university presidents pacific rim university alliance 21st century academic alliance international applied science and technology development collaboration network association of east asian research universities international alliance for new engineering education chinese universities planetary science alliance yangtze river delta research universities alliance member selected into the everest plan 111 plan 2011 plan outstanding engineer education and training plan outstanding doctor education and training plan outstanding legal talent education and training plan national construction high level university publicly sponsored graduate program new engineering research and practical projects national demonstration universities for deepening innovation and entrepreneurship education reform institutions receiving chinese government scholarships for international students in china ministry of education demonstration base for studying in china and national mass entrepreneurship and innovation demonstration base
S_HBUX,河北大学,河北大学（Hebei University）位于国家历史文化名城保定市，是列入教育部直属高校序列并与国家国防科技工业局和河北省人民政府“部局省合建”的重点综合性大学，中西部“一省一校”国家重点建设大学联盟成员，河北省重点支持的国家一流大学建设一层次高校；入选国家中西部高校综合实力提升工程、中西部高校基础能力建设工程、卓越工程师教育培养计划、首批卓越法律人才教育培养计划、国家级大学生创新创业训练计划、全国首批深化创新创业教育改革示范高校，是河北省首家中国政府奖学金来华留学生接收院校、国家大学生文化素质教育基地、全国高校首个延安精神教育基地、首批民政部社会工作专业人才培训基地，拥有研究生院和推荐免试研究生资格。,hebei university,hebei university is located in the national historical and cultural city of baoding it is a key comprehensive university listed in the list of universities directly under the ministry of education and jointly established with the state administration of science technology and industry for national defense and the hebei provincial peoples government a member of the national key construction university alliance of provincial first school a first level university in the construction of national first class universities supported by hebei province selected into the national central and western universities comprehensive strength enhancement project the central and western universities basic capacity building project the outstanding engineer education and training plan and the first batch excellent legal talent education and training program national college student innovation and entrepreneurship training program one of the first national demonstration universities to deepen innovation and entrepreneurship education reform the first institution in hebei province to receive international students with chinese government scholarships a national college student cultural quality education base and a national university it is the first spiritual education base in yanan and one of the first batch of social work professional training bases of the ministry of civil affairs it has graduate school and recommended postgraduate qualifications without examination
S_BUCM,北京中医药大学,北京中医药大学（Beijing University of Chinese Medicine，BUCM），简称“北中医”，是中华人民共和国教育部直属的一所以中医药学科为特色的全国重点大学，由教育部、国家卫生健康委员会、国家中医药管理局、北京市共同建设，是国家211工程、985工程优势学科创新平台重点建设院校、卓越医生（中医）教育培养计划改革试点高校、国家世界一流学科建设高校、世界一流中医药大学建设联盟创始成员，入选111计划、教育部来华留学示范基地、国家大学生创新性实验计划、中国政府奖学金来华留学生接收院校。,beijing university of chinese medicine,beijing university of chinese medicine bucm referred to as bucm is a national key university with characteristics of traditional chinese medicine directly under the ministry of education of the peoples republic of china it is composed of the ministry of education the national health commission and the national jointly constructed by the administration of traditional chinese medicine and beijing municipality it is a key construction university of the national 211 project and the 985 project advantageous discipline innovation platform a pilot university for the reform of the education and training program for outstanding doctors tcm a national world class discipline construction university and a world class traditional chinese medicine university a founding member of the construction alliance he was selected into the 111 project the ministry of education demonstration base for studying in china the national college student innovative experimental program and the chinese government scholarship receiving institution for international students in china
S_imvtc,内蒙古建筑职业技术学院,内蒙古建筑职业技术学院（Inner Mongola Techical College Of Construction）位于内蒙古呼和浩特市回民区，是内蒙古自治区唯一独立设置的建筑类高等院校。2004年10月，学院被教育部、建设部确定为国家建设行业技能型紧缺人才培养培训工程立项建设单位；2007年9月，学院被教育部、财政部确定为“国家示范性高等职业院校建设计划”立项建设单位。2014年，成为自治区首批招收应用型本科专业的高职院校。,inner mongolia vocational and technical college of architecture,inner mongola technical college of construction is located in huimin district hohhot city inner mongolia it is the only independently established construction higher education institution in the inner mongolia autonomous region in october 2004 the college was identified by the ministry of education and the ministry of construction as the construction unit of the national construction industrys skills based talent cultivation and training project in september 2007 the college was identified by the ministry of education and the ministry of finance as a national demonstration higher vocational college construction plan project construction unit in 2014 it became the first vocational college in the autonomous region to recruit applied undergraduate majors
S_CUP,中国石油大学（北京）,"中国石油大学（北京）（China University of Petroleum,Beijing）简称中石大（CUP），创建于1953年，由中华人民共和国教育部直属，位列国家首批“211工程”，首批“双一流”世界一流学科建设高校，北京高科大学联盟、世界能源大学联盟成员高校，入选985工程优势学科创新平台、“111计划”、卓越工程师教育培养计划、国家建设高水平大学公派研究生项目、新工科研究与实践项目、中国政府奖学金来华留学生接收院校，设有研究生院，是一所石油特色鲜明、以工为主、多学科协调发展的全国重点大学，被誉为“石油人才的摇篮”。",china university of petroleum (beijing),china university of petroleum beijing referred to as cup was founded in 1953 and is directly under the ministry of education of the peoples republic of china it is among the first batch of the countrys 211 project and the first batch of double first class a world class discipline building university a member of the beijing hi tech university alliance and the world energy university alliance selected into the 985 project advantage discipline innovation platform the 111 plan the outstanding engineer education and training plan the national high level university publicly sponsored graduate program new engineering research and it is a national key university with distinctive petroleum characteristics industry oriented and coordinated development of multiple disciplines it is known as the cradle of petroleum talents
S_HUBU,湖北大学,湖北大学（Hubei University）坐落于湖北省武汉市，是湖北省人民政府与教育部共建的省属重点综合性大学，入选“中西部高校基础能力建设工程”，是湖北省“2011计划”牵头高校，武器装备科研生产二级保密资格高校，中国政府奖学金来华留学生和港澳台学生接收高校，是教育部和英国大使馆批准设立的湖北省唯一的雅思（IELTS）考试考点单位。,hubei university,hubei university is located in wuhan city hubei province it is a provincial key comprehensive university jointly built by the hubei provincial peoples government and the ministry of education it was selected into the basic capacity building project of central and western universities and is the leader of hubei provinces 2011 plan it is a university with secondary confidentiality qualifications for weapons and equipment scientific research and production it is a university that accepts chinese government scholarship students from china and students from hong kong macao and taiwan it is the only ielts test center in hubei province approved by the ministry of education and the british embassy
S_ustcX,中国科学技术大学,中国科学技术大学（University of Science and Technology of China），简称“中国科大”，位于安徽省合肥市，由中国科学院直属，中央直管副部级建制，位列“双一流”、“211工程”、“985工程”，入选“珠峰计划”、“111计划”、“2011计划”、“中国科学院知识创新工程”,university of science and technology of china,the university of science and technology of china referred to as ustc is located in hefei city anhui province it is directly under the chinese academy of sciences and directly under the central government at the deputy ministerial level it ranks among the double first class and 211 project  985 project selected into the everest plan 111 plan 2011 plan knowledge innovation project of the chinese academy of sciences
S_CUC,中国传媒大学,中国传媒大学是教育部直属的国家“211工程”、“985工程”优势学科创新平台，是国家首批“双一流”世界一流学科建设高校，被誉为“信息传播领域最高学府”。,communication university of china,communication university of china is a national 211 project and 985 project advantageous discipline innovation platform directly under the ministry of education it is one of the first batch of national double first class world class discipline construction universities and is known as the highest university in the field of information communication
S_DYU,大叶大学,"大叶大学位于中国台湾省彰化县，创校于1990年3月，原名“大叶工学院”，并于1997年改名为“大叶大学”。2015年2月西班牙Webometrics世界大学排名中，位列全球22,000所大学之前 6%，全台湾159所高校中，排名更是进步到第49名，领先110所公、私立大学，另据中国校友会网发布2013年港澳台两岸三地高校（约180校）最佳大学排行榜，本校排第42名，港澳台排名在前1/4的最佳高校。",daye university,daye university is located in changhua county taiwan province china it was founded in march 1990 it was originally named daye institute of technology and was renamed daye university in 1997 in the spanish webometrics world university rankings in february 2015 it ranked in the top 6 of 22000 universities in the world among 159 universities in taiwan its ranking improved to 49th ahead of 110 public and private universities according to the china alumni association the website released the 2013 best university rankings of universities about 180 schools in hong kong macao taiwan and taiwan our school ranked 42nd and the best universities in hong kong macao and taiwan ranked in the top 14
S_ChongqingUX,重庆大学,重庆大学（Chongqing University），简称重大（CQU），位于中央直辖市重庆，是中共中央直管，教育部直属的副部级全国重点大学，是国家31所中管高校之一，由教育部和重庆市共同建设。重大早在民国时期就是中国最杰出的国立大学之一；现是国家“双一流”A类世界一流大学、“211工程”和“985工程”首批重点建设的高水平研究型综合性大学；入选“2011计划”、“111计划”、“卓越工程师教育培养计划”、“卓越法律人才教育培养计划”、“海外高层次人才引进计划”、“中国政府奖学金来华留学生接收院校”、“教育部来华留学示范基地”、“国家建设高水平大学公派研究生项目”；也是“中俄工科大学联盟”、“中英大学工程教育与研究联盟”、“重庆市大学联盟”、“中国酿酒高校联盟”成员，设有研究生院。,chongqing university,chongqing university referred to as cqu is located in chongqing a municipality directly under the central government it is a vice ministerial national key university directly under the central committee of the communist party of china and directly under the ministry of education it is one of the countrys 31 centrally managed universities and is jointly managed by the ministry of education and chongqing university city joint construction jnu has been one of the most outstanding national universities in china as early as the republic of china now it is a national double first class class a world class university and one of the first batch of key construction high level research oriented comprehensive universities under the 211 project and 985 project selected into the 2011 plan 111 plan excellent engineer education and training plan excellent legal talent education and training plan overseas high level talent introduction plan chinese government scholarship receiving colleges for international students in china  demonstration base for studying in china by the ministry of education national postgraduate program for building high level universities also china russian engineering university alliance sino british university engineering education and research alliance chongqing university alliance china brewery it is a member of the university alliance and has a graduate school
S_BJUT,北京工业大学,北京工业大学（Beijing University of Technology），简称“北工大”。学校创建于1960年，属北京市人民政府管理，初设机械、电机、无线电、化工、数理5个系，历经多次整合兼并，逐渐发展成为一所以工为主，理、工、经、管、文、法、艺术等9大学科门协调发展的研究型大学。学校是国家“双一流——世界一流学科建设” 高校，国家“211工程”重点建设院校，入选“111计划”、”海外高层次人才引进计划”  、“国家建设高水平大学公派研究生项目”、国家大学生创新性实验计划，为国家首批61所“卓越工程师教育培养计划”入选高校、国家“863计划”、“973计划”承担高校之一，拥有国家大学科技园，具有自主招生资格。2017年QS世界大学排名中位列亚洲百强。,beijing university of technology,beijing university of technology referred to as beijing university of technology the school was founded in 1960 and is under the management of the beijing municipal peoples government it initially established five departments mechanical electrical radio chemical engineering and mathematics after many mergers and acquisitions it has gradually developed into a engineering focused university with science engineering economics and management it is a research oriented university with coordinated development of nine major disciplines including liberal arts law and arts the school is a national double first class   world class discipline construction university a key construction institution of the national 211 project and has been selected into the 111 plan the overseas high level talent introduction plan and the national high level university publicly sponsored graduate program  national college student innovative experimental program one of the first 61 universities selected for the countrys excellent engineer education and training program and one of the universities responsible for the national 863 plan and 973 plan it has a national university science and technology park and has independent enrollment qualifications ranked among the top 100 universities in asia in the 2017 qs world university rankings
S_xuetang,学堂在线,学堂在线是由清华大学研发出的中文MOOC（大规模开放在线课程，简称慕课）平台，于2013年10月10日正式启动，面向全球提供在线课程。任何拥有上网条件的学生均可通过该平台，在网上学习课程视频。2015年，学堂在线运行了包括清华大学、北京大学、复旦大学、斯坦福大学、麻省理工学院、加州大学伯克利分校等国内外几十所顶尖高校的优质课程，涵盖计算机、经管创业、理学、工程、文学、历史、艺术等多个领域。在2016年发布的“全球慕课排行”中，学堂在线被评为“拥有最多精品好课”的三甲平台之一。截至到2016年10月，学堂在线注册用户数达到500万，选课人次690万，运行的课程数量已经超过1000门。,xuetang online,xuetang online is a chinese mooc massive open online course referred to as mooc platform developed by tsinghua university it was officially launched on october 10 2013 and provides online courses to the world any student with internet access can use this platform to study course videos online in 2015 xuetang online ran high quality courses from dozens of top universities at home and abroad including tsinghua university peking university fudan university stanford university mit and the university of california berkeley covering computer science economics management entrepreneurship science and engineering  literature history art and other fields in the global mooc ranking released in 2016 xuetang online was rated as one of the top three platforms with the most high quality courses as of october 2016 the number of registered users of xuetang online has reached 5 million 69 million people have chosen courses and the number of courses in operation has exceeded 1000
